-1zPoF7XXq0	WORST to BEST Characters for Beginner's RANKED in Deadlock
5W5Itue9Mhs	Top 10 BEST Duo Strategies to DOMINATE in Deadlock
F6yD7JAaOEw	10 Things I Wish I knew Before I Played Deadlock
K_PsKsUPEZQ	The COMPLETE DEADLOCK Beginner's Guide - Everything you NEED to Know Before you Play!
Iy_pN0dtQmY	I Quit Marvel Rivals | An Eternity's Perspective
vZqiGZ_FPTQ	I Finished Marvel Rivals: This is What I Learned
UWGwFFN0-pQ	#1 Duelist Mains Share Their BEST TIPS
JxClBu6Z9Ps	How to MASTER Aim in Marvel Rivals
AGjGhs4xKZc	Educational Unranked to GM Black Cat (67% Winrate)
pL7mAWytrB0	Black Cat Guide | The BEST Comprehensive Guide to BLACK CAT in Marvel Rivals
XMWoWKnFlUM	Play These 10 Heroes to RANK UP FAST in Marvel Rivals 7.5!
zFSHto3Amlc	How To Get So Good At Poke It Feels Like Cheating
Yt8Tn07MeLA	Educational Unranked to GM WHITE FOX (76% Winrate)
cSbM4klKHtY	How To Get So Good At Brawl It Feels Like Cheating
ndvU5je-UFo	How To Dive So Well Supports Go ON STRIKE
agc2g5G7fwM	White Fox Guide | The BEST Comprehensive Guide to WHITE FOX in Marvel Rivals
logosuNK8Ug	Play These 10 Heroes to RANK UP FAST in Marvel Rivals Season 7!
0WpZvJ8lrmU	How To Get So Good At Duelist It Feels Like Cheating
GA8TFOPxBks	Ranking WORST to BEST CARRY HEROES in Marvel Rivals
N0BWg3QMgck	Educational Unranked to GM ELSA BLOODSTONE (91% Winrate)
Vmt7pwpSv1M	Play These 10 Heroes to RANK UP FAST in Marvel Rivals Season 6.5!
iY2Yb9juP5w	#1 Vanguard Mains Share Their BEST TIPS
XTUTGUIFfUY	Elsa Bloodstone Guide | The BEST Comprehensive Guide to ELSA BLOODSTONE in Marvel Rivals
8-bMoxrVxYs	How To Get So Good At Vanguard It Feels Like Cheating
mNiE-e1hlRg	Educational Unranked to GM DEADPOOL (73% Winrate)
0AkMzA-n-EA	Black Panther Guide | The BEST Comprehensive Guide to BLACK PANTHER in Marvel Rivals
bOcKUc0prT4	Ranking WORST to BEST Vanguards to RANK UP With in Marvel Rivals
JfrdVuQ5mn0	Deadpool Guide | The BEST Comprehensive Guide to DEADPOOL in Marvel Rivals
UaF6jKVNnLo	Play These 10 Heroes to RANK UP FAST in Marvel Rivals Season 6!
qHKZJtE_ZDs	Educational Unranked to GM THOR (69% Winrate)
Q8xdV5RguZQ	Educational Unranked to GM WOLVERINE
_F5nOfRLy8A	Thor Guide | The BEST Comprehensive Guide to THOR in Marvel Rivals
f2Y2V6tCmBM	Educational Unranked to GM SCARLET WITCH (80% Winrate)
cPujUz0S7nQ	Scarlet Witch Guide | The BEST Comprehensive Guide to SCARLET WITCH in Marvel Rivals
1vfUB84qOcQ	Educational Unranked to GM Peni Parker
xkqZERUI3Gc	Educational Unranked to GM MISTER FANTASTIC (66.6% Winrate)
pUaLtWfMR7A	Educational Unranked to GM ROGUE (76% Winrate)
LGAj_h43m5A	Rogue Guide | The BEST Comprehensive Guide to ROGUE in Marvel Rivals
L7XTpvW84L0	Play These 10 Heroes to RANK UP FAST in Marvel Rivals Season 5.5!
V4DFywKwdFk	Mister Fantastic Guide | The BEST Comprehensive Guide to MISTER FANTASTIC in Marvel Rivals
6QUPcgfzeOg	Marvel Rivals Season 5.0 Heroes RANKED - The DEFINITIVE WORST to BEST Heroes in the Season
fHwTq8w2FVU	Peni Parker Guide | The BEST Comprehensive Guide to PENI PARKER in Marvel Rivals
J2sqWAV2ubs	Wolverine Guide | The BEST Comprehensive Guide to WOLVERINE in Marvel Rivals
q7VFwFPnwLc	Educational Bronze to GM MAGIK
9B-oqk3geJU	Educational Unranked to GM GAMBIT (85% Winrate)
WIHDdJujzUs	Gambit Guide | The BEST Comprehensive Guide to GAMBIT in Marvel Rivals
UXPcWcWfj3I	Play These 10 Heroes to RANK UP FAST in Marvel Rivals Season 5!
lDZ7MxKBVms	Educational Bronze to GM MOON KNIGHT (82% Winrate)
Tq9XO0AkX0g	Educational Bronze to GM CAPTAIN AMERICA (68% Winrate)
yHH6KBvciPg	Moon Knight Guide | The BEST Comprehensive Guide to MOON KNIGHT in Marvel Rivals
K43CMjuhKkA	Marvel Rivals Season 4.5 Heroes RANKED - The DEFINITIVE WORST to BEST Heroes in NEW META
HZrBVN4tuik	Captain America Guide | The BEST Comprehensive Guide to CAPTAIN AMERICA in Marvel Rivals
jMZxADS98q0	Educational Bronze to GM IRON FIST (74% Winrate)
xfZl57O8_OQ	Iron Fist Guide | The BEST Comprehensive Guide to IRON FIST in Marvel Rivals
v5lTA4VxgvA	Educational Bronze to GM VENOM
7j3URa0QWME	Educational Bronze to GM DAREDEVIL (76% Winrate)
HRXsRdVXMVo	Daredevil Guide | The BEST Comprehensive Guide to DAREDEVIL in Marvel Rivals
OHHMfZxg8GU	Educational Bronze to GM HAWKEYE (TOP 0.85% | 70% Winrate)
0-M346k5DPw	Play These 10 Heroes to RANK UP FAST in Marvel Rivals Season 4.5!
3HMlrN1UxIc	Venom Guide | The BEST Comprehensive Guide to VENOM in Marvel Rivals
L10v3F9r5Hs	Hawkeye Guide | The BEST Comprehensive Guide to HAWKEYE in Marvel Rivals!
4vilAy9tSwY	Magik Guide | The BEST Comprehensive Guide to MAGIK in Marvel Rivals
j1poGPZirqE	Educational Bronze to GM ANGELA (TOP 0.26% | 73% Winrate)
U8hEMK0OFRI	How to CLIMB FAST in Season 4 of Marvel Rivals
HRkY4e6CFow	Angela Guide | The BEST Comprehensive Guide to ANGELA in Marvel Rivals
Dw7mmPTqOqI	Play These 10 Heroes to RANK UP FAST in Marvel Rivals Season 4.0!
OMxg_6cOgHE	Educational Bronze to GM BLACK WIDOW (82% Winrate)
LMej9-pVFek	Black Widow Guide | The BEST Comprehensive Guide to BLACK WIDOW in Marvel Rivals
AkFyGHcamNY	10 MOST COMMON Low Elo Mistakes in Marvel Rivals (and how to fix them)
K4u47PLU8sg	Educational Bronze to GM SQUIRREL GIRL (70% Winrate)
hfHY0afkEUg	Squirrel Girl Guide | The BEST Comprehensive Guide to SQUIRREL GIRL in Marvel Rivals
u63eVJWqobU	Educational Bronze to GM DOCTOR STRANGE (72% Winrate)
8ZyNSU1fBAk	Doctor Strange Guide | The BEST Comprehensive Guide to DOCTOR STRANGE in Marvel Rivals
0um39F2qrvc	Educational Bronze to GM HULK (70% Winrate)
YZf3psRKPmE	Hulk Guide | The BEST Comprehensive Guide to HULK in Marvel Rivals
wTtbHe71IQ0	Marvel Rivals Season 3.5 Heroes RANKED - The DEFINITIVE WORST to BEST Heroes in NEW META
p0TXluOIHsQ	Educational Bronze to GM BLADE (71% Winrate)
WPEDkYY4eGA	Blade Guide | The BEST Comprehensive Guide to BLADE in Marvel Rivals
4v8z3cfLY8Y	Play These 10 Heroes to RANK UP FAST in Marvel Rivals Season 3.5!
YccqF6OvAKE	Educational Bronze to GM STORM (TOP 1.6% | 87% WINRATE)
mlewjqlw91c	Storm Guide | The BEST Comprehensive Guide to STORM in Marvel Rivals
eBmUlAWmwoI	#1 Strategist Mains Share Their BEST TIPS
JgrH8_ajMFY	Educational Bronze to GM NAMOR (TOP 1.2% | 80% WINRATE)
FPPs-i1ee-g	Namor Guide | The BEST Comprehensive Guide to NAMOR in Marvel Rivals
sixEechHfpw	Educational Bronze to GM THE THING (TOP .8% | 70% Winrate)
8IJGdtB9s2s	The Thing Guide | The BEST Comprehensive Guide to THE THING in Marvel Rivals
HDH9kCm1vQQ	Stats DON'T MATTER in Marvel Rivals
kP-596xnD5o	Educational Bronze to GM PHOENIX (TOP .45% | 75% Winrate)
OoQyu_WzbBY	Phoenix Guide | The BEST Comprehensive Guide to PHOENIX in Marvel Rivals
AvUWx6sh2yc	Play These 10 Heroes to RANK UP FAST in Marvel Rivals Season 3.0!
f-uOmTTKj88	Educational Bronze to GM HUMAN TORCH (80% Winrate)
P9NvGuL_cho	Human Torch Guide | The BEST Comprehensive Guide to HUMAN TORCH in Marvel Rivals
AGjm_wf73QA	Educational Bronze to GM GROOT (80% Winrate)
l6xG6WAsYMU	Groot Guide | The BEST Comprehensive Guide to GROOT in Marvel Rivals
uefyKm8Mo-U	How To Get So Good At Strategist It Feels Like Cheating
RzNES06svys	Educational Bronze to GM WINTER SOLDIER (80% Winrate)
mc--EjMwJgA	Winter Soldier Guide | The BEST Comprehensive Guide to WINTER SOLDIER in Marvel Rivals
9W22wgE_V7Y	Educational Bronze to GM MAGNETO (80% Winrate)
7qG9KH9UkNc	Magneto Guide | The BEST Comprehensive Guide to MAGNETO in Marvel Rivals
kqh4tMmAr6A	Play These 10 Heroes to RANK UP FAST in Marvel Rivals Season 2.5!
8eANxhLYzaI	Educational Bronze to GM THE PUNISHER (85% Winrate)
T0d2S3gRW-M	Punisher Guide | The BEST Comprehensive Guide to THE PUNISHER in Marvel Rivals
hLcY7FlofGI	1 ULTRON TIP vs EVERY HERO
YThfkJ5St54	Educational Bronze to GM ULTRON (80% Winrate)
YKcxUGf25Es	Ultron Guide | The BEST Comprehensive Guide to ULTRON in Marvel Rivals
E-4Je_ZXQ0s	Educational Bronze to GM IRON MAN (98% Winrate)
3hV4kz3Repc	Iron Man Guide | The BEST Comprehensive Guide to IRON MAN in Marvel Rivals
-VxfFAYW3v8	Educational Bronze to GM Psylocke (80% Winrate)
p694021ZWT8	Ranking WORST to BEST Strategists to RANK UP With in Marvel Rivals
Vsua14VUmGg	Psylocke Guide | The BEST Comprehensive Guide to PSYLOCKE in Marvel Rivals
MK92QI-J93k	1 EMMA FROST TIP vs EVERY HERO
brM9gglIoHQ	Educational Bronze to GM CLOAK and DAGGER (80% Winrate)
E9lKTfRFJ6s	Cloak and Dagger Guide | The BEST Comprehensive Guide to CLOAK AND DAGGER in Marvel Rivals
GTluIg_FnZ8	Educational Bronze to GM JEFF THE SHARK
bEtshLmrVyw	Jeff the Shark Guide | The BEST Comprehensive Guide to JEFF THE SHARK in Marvel Rivals
_T9rY3Gqi2M	Educational Bronze to GM ROCKET RACCOON (88% Winrate)
CGw4ZlAMAF4	Rocket Raccoon Guide | The BEST Comprehensive Guide to ROCKET RACCOON in Marvel Rivals
4KzDRwafQsg	Educational Bronze to GM EMMA FROST (80% Winrate)
geqHn_q6k7w	Emma Frost Guide | The BEST Comprehensive Guide to EMMA FROST in Marvel Rivals
YbBmyFjJubQ	Marvel Rivals Mythbusters - Emma Frost Edition
fCejAJQes48	Educational Bronze to GM HELA (85% Winrate)
KD6ORSun0ZE	Hela Guide | The BEST Comprehensive Guide to HELA in Marvel Rivals
m0okEiF55cY	Educational Bronze to GM INVISIBLE WOMAN (86% Winrate)
mRt2zFGqrws	Invisible Woman Guide | The BEST Comprehensive Guide to INVISIBLE WOMAN in Marvel Rivals
R0CQFSmAo0U	Spectating a PRO ADAM WARLOCK in Marvel Rivals | Shikigami Shocker
LuEGHIx6aC4	Educational Bronze to GM ADAM WARLOCK (85% WINRATE)
GqRusLyDjL0	Adam Warlock Guide | The BEST Comprehensive Guide to ADAM WARLOCK in Marvel Rivals
hpxYdpMR4Ok	Spectating a ONE ABOVE ALL MANTIS in Marvel Rivals | mcjohn1
63S6wxKAhDU	Educational Bronze to GM MANTIS (98% WINRATE)
Fifg2W8-PO4	Mantis Guide | The BEST Comprehensive Guide to MANTIS in Marvel Rivals
sODXalThk-o	Spectating a PRO STARLORD in Marvel Rivals | SEN Rymazing
_NYL8s6iGjw	Educational Bronze to GM STARLORD (85% Winrate)
71rolJfkehc	Starlord Guide | The BEST Comprehensive Guide to STARLORD in Marvel Rivals
25BmYdn-s5w	Spectating a PRO LUNA SNOW in Marvel Rivals | LG Paradoxed
iBbgVSrHutM	Educational Bronze to GM LUNA SNOW (91% Winrate)
jzICK22y7Is	Luna Snow Guide | The BEST Comprehensive Guide to LUNA SNOW in Marvel Rivals
kmc56Lfy-Ng	Spectating the RANK 1 LOKI in Marvel Rivals | 100T hxrvey
7kn6SNEqwXI	Educational Bronze to GM LOKI (85% Winrate)
zwM6YQ4v_SI	Loki Guide | The BEST Comprehensive Guide to Loki in Marvel Rivals
kCU7-2AOyR0	TRIPLE SUPPORT IS DEAD - Marvel Rivals Season 1.5 Patch Changes EVERYTHING about the NEW META
a13noekG-z8	You SUCK At EVERY ROLE in Marvel Rivals | Quick Fix Guide to CLIMB NOW
cUslZkGVsLA	One Tip For EVERY RANK in Marvel Rivals | Tips and Tricks to RANK UP FAST
Zy-A90S14kI	Play These 10 Heroes to CLIMB FAST in Marvel Rivals Season 1!
PMzskvVC9LU	How To Become GODLY at Marvel Rivals | Tips and Tricks Guide to CARRYING Lobbies
_vFb_7OvLQ4	I Climbed to GRANDMASTER in Less Than 10 Hours in Marvel Rivals - This is What I Learned
FMX00yYqVj8	5 Tips I WISH I Knew Before Playing Marvel Rivals
RLTJqjg4mLU	SUPERVIVE Community, We Need to Talk... | Why I'm Stepping Back Until Release
FjnodhxupGc	*NEW* SUPERVIVE Season 0 Patch 2! | NEW Leveling System, Hunter Balancing, and NEW Powers
wndAoxeCdBA	*NEW* 5 Tips to DOMINATE the Early Game in SUPERVIVE | SUPERVIVE Early Game Macro Guide
YGzxWifM24I	*NEW* SUPERVIVE Season 0 Open Beta Hunters RANKED - The DEFINITIVE WORST to BEST Hunters in NEW META